Movie Title,Year,Score,Adjusted Score,Director,Synopsis,Cast,Consensus
Battle Royale,2000,88,88055,Kinji Fukasaku,"42 9th graders are sent to a deserted island. They are given a map, food, and various weapons. An explosive... [More]","Tatsuya Fujiwara, Aki Maeda, Taro Yamamoto, Masanobu Andô","Battle Royale is a controversial and violent parable of adolescence, heightening teenage melodrama with life-or-death stakes."
Spider-Man 2,2004,93,104581,Sam Raimi,"When a failed nuclear fusion experiment results in an explosion that kills his wife, Dr. Otto Octavius (Alfred Molina) is... [More]","Tobey Maguire, Kirsten Dunst, James Franco, Alfred Molina","Boasting an entertaining villain and deeper emotional focus, this is a nimble sequel that improves upon the original."
13 Assassins,2010,95,100003,Takashi Miike,"In this remake of a 1963 film based on historical events, Shinzaemon Shimada leads a team of assassins in 19th-century... [More]","Koji Yakusho, Takayuki Yamada, Yusuke Iseya, Goro Inagaki","Takashi Miike's electric remake of Eiichi Kudo's 1963 period action film is a wild spectacle executed with killer, dizzying panache."
Full Contact,1992,89,76979,Ringo Lam,"Jeff (Chow Yun-Fat), who works as a nightclub bouncer in Bangkok, saves his friend Sam (Wong Chow-Sang) from a beating... [More]","Chow Yun-Fat, Simon Yam, Bonnie Fu, Wong Chow-Sang",No consensus yet.
Indiana Jones and the Last Crusade,1989,88,93953,Steven Spielberg,An art collector appeals to Jones to embark on a search for the Holy Grail. He learns that another archaeologist... [More],"Harrison Ford, Sean Connery, Denholm Elliott, Alison Doody","Lighter and more comedic than its predecessor, Indiana Jones and the Last Crusade returns the series to the brisk serial adventure of Raiders, while adding a dynamite double act between Harrison Ford and Sean Connery."
Kung Fu Hustle,2004,90,98139,Stephen Chow,"When the hapless Sing (Stephen Chow) and his dim-witted pal, Bone (Feng Xiaogang), try to scam the residents of Pig... [More]","Stephen Chow, Yuen Wah, Yuen Qiu, Siu-Lung Leung","Kung Fu Hustle blends special effects, martial arts, and the Looney Toons to hilarious effect."
A Better Tomorrow,1986,93,92519,John Woo,A Hong Kong policeman (Leslie Cheung) blames his reformed-gangster brother (Chow Yun-Fat) for the death of their father.... [More],"Ti Lung, Chow Yun-Fat, Leslie Cheung, Emily Chu",No consensus yet.
Iron Man,2008,94,105230,Jon Favreau,"A billionaire industrialist and genius inventor, Tony Stark (Robert Downey Jr.), is conducting weapons tests overseas, but terrorists kidnap him... [More]","Robert Downey Jr., Terrence Howard, Gwyneth Paltrow, Jeff Bridges","Powered by Robert Downey Jr.'s vibrant charm, Iron Man turbo-charges the superhero genre with a deft intelligence and infectious sense of fun."
The Night Comes for Us,2018,91,91146,Timo Tjahjanto,"Ito, a gangland enforcer, is caught amidst a treacherous and violent insurrection within his Triad crime family.... [More]","Joe Taslim, Iko Uwais, Julie Estelle, Sunny Pang","A bloody thrill ride designed to test the limits of more squeamish viewers, The Night Comes for Us wields a stylishly violent, action-packed punch."
Logan,2017,94,126307,James Mangold,"In the near future, a weary Logan (Hugh Jackman) cares for an ailing Professor X (Patrick Stewart) at a remote... [More]","Hugh Jackman, Patrick Stewart, Dafne Keen, Richard E. Grant","Hugh Jackman makes the most of his final outing as Wolverine with a gritty, nuanced performance in a violent but surprisingly thoughtful superhero action film that defies genre conventions."
Goldfinger,1964,99,104217,Guy Hamilton,"Special agent 007 (Sean Connery) comes face to face with one of the most notorious villains of all time, and... [More]","Sean Connery, Gert Frobe, Honor Blackman, Shirley Eaton","Goldfinger is where James Bond as we know him comes into focus - it features one of 007's most famous lines (""A martini. Shaken, not stirred."") and a wide range of gadgets that would become the series' trademark."
Assault on Precinct 13,1976,95,98790,John Carpenter,"When the LAPD kills several members of the South Central gang Street Thunder, the remaining members avenge themselves by way... [More]","Austin Stoker, Darwin Joston, Laurie Zimmer, Martin West","Lean, taut and compellingly gritty, John Carpenter's loose update of Rio Bravo ranks as a cult action classic and one of the filmmaker's best."
Wonder Woman,2017,93,129245,Patty Jenkins,"Before she was Wonder Woman (Gal Gadot), she was Diana, princess of the Amazons, trained to be an unconquerable warrior.... [More]","Gal Gadot, Chris Pine, Connie Nielsen, Robin Wright","Thrilling, earnest, and buoyed by Gal Gadot's charismatic performance, Wonder Woman succeeds in spectacular fashion."
The Chinese Connection,1972,83,83269,Lo Wei,"Chen Zhen (Bruce Lee) has left his homeland of China and relocated to stay with family in Thailand. Chen, who... [More]","Bruce Lee, Miao Ker Hsiu, James Tien, Robert Baker",No consensus yet.
Captain America: The Winter Soldier,2014,90,102773,Anthony Russo,"After the cataclysmic events in New York with his fellow Avengers, Steve Rogers, aka Captain America (Chris Evans), lives in... [More]","Chris Evans, Scarlett Johansson, Samuel L. Jackson, Sebastian Stan","Suspenseful and politically astute, Captain America: The Winter Soldier is a superior entry in the Avengers canon and is sure to thrill Marvel diehards."
Oldboy,2003,81,87302,Park Chan-wook,"Dae-Su is an obnoxious drunk bailed from the police station yet again by a friend. However, he's abducted from the... [More]","Choi Min-sik, Yoo Ji-tae, Kang Hye-jung, Ji Dae-han","Violent and definitely not for the squeamish, Park Chan-Wook's visceral Oldboy is a strange, powerful tale of revenge."
The French Connection,1971,95,104241,William Friedkin,"New York Detective ""Popeye"" Doyle (Gene Hackman) and his partner (Roy Scheider) chase a French heroin smuggler.... [More]","Gene Hackman, Fernando Rey, Roy Scheider, Tony Lo Bianco","Realistic, fast-paced and uncommonly smart, The French Connection is bolstered by stellar performances by Gene Hackman and Roy Scheider, not to mention William Friedkin's thrilling production."
Furious 7,2015,81,92762,James Wan,"After defeating international terrorist Owen Shaw, Dominic Toretto (Vin Diesel), Brian O'Conner (Paul Walker) and the rest of the crew... [More]","Vin Diesel, Paul Walker, Dwayne Johnson, Michelle Rodriguez","Serving up a fresh round of over-the-top thrills while adding unexpected dramatic heft, Furious 7 keeps the franchise moving in more ways than one."
La Femme Nikita,1990,89,90862,Luc Besson,"Convicted felon Nikita (Anne Parillaud), instead of going to jail, is given a new identity and trained to be a... [More]","Anne Parillaud, Jean-Hugues Anglade, Tcheky Karyo, Jeanne Moreau",A zany out-of-control thriller that gives lead Anne Parillaud a big character arc and plenty of emotional room to work within.
Supercop,1992,94,97858,Stanley Tong,"To infiltrate a drug cartel, police Inspector Chan Ka Kui (Jackie Chan) goes undercover in a Chinese prison. There, he... [More]","Jackie Chan, Michelle Yeaoh, Maggie Cheung, Ken Tsang","Blending hand-to-hand combat with breathtaking stunts and slapstick comedy, Supercop reminds us why Jackie Chan is one of the world's great entertainers."
Dirty Harry,1971,89,93163,Don Siegel,Cop Harry Callahan (Clint Eastwood) attempts to track down a psychopathic rooftop killer before a kidnapped girl dies. When he... [More],"Clint Eastwood, Harry Guardino, Reni Santoni, John Larch","As tough and taciturn as its no-nonsense hero, Dirty Harry delivers a deceptively layered message without sacrificing an ounce of its solid action impact."
Edge of Tomorrow,2014,91,104924,Doug Liman,"When Earth falls under attack from invincible aliens, no military unit in the world is able to beat them. Maj.... [More]","Tom Cruise, Emily Blunt, Brendan Gleeson, Bill Paxton","Gripping, well-acted, funny, and clever, Edge of Tomorrow offers entertaining proof that Tom Cruise is still more than capable of shouldering the weight of a blockbuster action thriller."
X2,2003,85,93363,Bryan Singer,"Stryker (Brian Cox), a villianous former Army commander, holds the key to Wolverine's (Hugh Jackman) past and the future of... [More]","Patrick Stewart, Hugh Jackman, Ian McKellen, Halle Berry","Tightly scripted, solidly acted, and impressively ambitious, X2: X-Men United is bigger and better than its predecessor -- and a benchmark for comic sequels in general."
The Fugitive,1993,96,102560,Andrew Davis,"Wrongfully accused of murdering his wife, Richard Kimble (Harrison Ford) escapes from the law in an attempt to find her... [More]","Harrison Ford, Tommy Lee Jones, Sela Ward, Julianne Moore","Exhilarating and intense, this high-impact chase thriller is a model of taut and efficient formula filmmaking, and it features Harrison Ford at his frantic best."
Black Panther,2018,96,129329,Ryan Coogler,"After the death of his father, T'Challa returns home to the African nation of Wakanda to take his rightful place... [More]","Chadwick Boseman, Michael B. Jordan, Lupita Nyong'o, Danai Gurira",Black Panther elevates superhero cinema to thrilling new heights while telling one of the MCU's most absorbing stories -- and introducing some of its most fully realized characters.
Inception,2010,87,102242,Christopher Nolan,Dom Cobb (Leonardo DiCaprio) is a thief with the rare ability to enter people's dreams and steal their secrets from... [More],"Leonardo DiCaprio, Joseph Gordon-Levitt, Ellen Page, Tom Hardy","Smart, innovative, and thrilling, Inception is that rare summer blockbuster that succeeds viscerally as well as intellectually."
Braveheart,1995,76,81544,Mel Gibson,Tells the story of the legendary thirteenth century Scottish hero named William Wallace (Mel Gibson). Wallace rallies the Scottish against... [More],"Mel Gibson, Sophie Marceau, Patrick McGoohan, Catherine McCormack","Distractingly violent and historically dodgy, Mel Gibson's Braveheart justifies its epic length by delivering enough sweeping action, drama, and romance to match its ambition."
Minority Report,2002,90,98085,Steven Spielberg,"Based on a story by famed science fiction writer Philip K. Dick, ""Minority Report"" is an action-detective thriller set in... [More]","Tom Cruise, Colin Farrell, Samantha Morton, Max von Sydow","Thought-provoking and visceral, Steven Spielberg successfully combines high concept ideas and high octane action in this fast and febrile sci-fi thriller."
Avengers: Endgame,2019,94,128420,Anthony Russo,"Adrift in space with no food or water, Tony Stark sends a message to Pepper Potts as his oxygen supply... [More]","Robert Downey Jr., Chris Evans, Mark Ruffalo, Chris Hemsworth","Exciting, entertaining, and emotionally impactful, Avengers: Endgame does whatever it takes to deliver a satisfying finale to Marvel's epic Infinity Saga."
Dredd,2012,79,86263,Pete Travis,"Mega City One is a vast, violent metropolis where felons rule the streets. The only law lies with cops called... [More]","Karl Urban, Olivia Thirlby, Lena Headey, Wood Harris","Fueled by bombastic violence and impressive special effects, rooted in self-satire and deadpan humor, Dredd 3D does a remarkable job of capturing its source material's gritty spirit."
The Bourne Identity,2002,84,89633,Doug Liman,"The story of a man (Matt Damon), salvaged, near death, from the ocean by an Italian fishing boat. When he... [More]","Matt Damon, Franka Potente, Chris Cooper, Clive Owen","Expertly blending genre formula with bursts of unexpected wit, The Bourne Identity is an action thriller that delivers -- and then some."
Ip Man,2008,86,86375,Wilson Yip,"The life story of Yip Man, the first person to teach the Chinese martial art of Wing Chun.... [More]","Donnie Yen, Simon Yam, Siu-wong Fan, Ka Tung Lam","At once beholden to the established conventions of the genre and delightfully subversive of them, Ip Man is one of the most exciting -- and refreshingly character-driven -- martial arts films in years."
Face/Off,1997,92,97276,John Woo,"Obsessed with bringing terrorist Castor Troy (Nicolas Cage) to justice, FBI agent Sean Archer (John Travolta) tracks down Troy, who... [More]","John Travolta, Nicolas Cage, Joan Allen, Alessandro Nivola","John Travolta and Nicolas Cage play cat-and-mouse (and literally play each other) against a beautifully stylized backdrop of typically elegant, over-the-top John Woo violence."
To Live and Die in L.A.,1985,85,88341,William Friedkin,"When his longtime partner on the force is killed, reckless U.S. Secret Service agent Richard Chance (William L. Petersen) vows... [More]","William L. Petersen, Willem Dafoe, John Pankow, Debra Feuer","With coke fiends, car chases, and Wang Chung galore, To Live and Die in L.A. is perhaps the ultimate '80s action/thriller."
The Dark Knight,2008,94,108290,Christopher Nolan,"With the help of allies Lt. Jim Gordon (Gary Oldman) and DA Harvey Dent (Aaron Eckhart), Batman (Christian Bale) has... [More]","Christian Bale, Heath Ledger, Aaron Eckhart, Michael Caine","Dark, complex, and unforgettable, The Dark Knight succeeds not just as an entertaining comic book film, but as a richly thrilling crime saga."
Mission: Impossible -- Ghost Protocol,2011,93,103461,Brad Bird,"Blamed for a terrorist attack on the Kremlin, Ethan Hunt (Tom Cruise) and the entire IMF agency are disavowed by... [More]","Tom Cruise, Jeremy Renner, Simon Pegg, Paula Patton","Stylish, fast-paced, and loaded with gripping set pieces, the fourth Mission: Impossible is big-budget popcorn entertainment that really works."
Fast Five,2011,77,85278,Justin Lin,Ever since ex-cop Brian O'Conner (Paul Walker) and Mia Torretto (Jordana Brewster) broke her brother Dom (Vin Diesel) out of... [More],"Vin Diesel, Paul Walker, Jordana Brewster, Tyrese Gibson","Sleek, loud, and over the top, Fast Five proudly embraces its brainless action thrills and injects new life into the franchise."
Lethal Weapon,1987,80,83866,Richard Donner,"Following the death of his wife, Los Angeles police detective Martin Riggs (Mel Gibson) becomes reckless and suicidal. When he... [More]","Mel Gibson, Danny Glover, Gary Busey, Mitchell Ryan","The most successful installment in a phenomenally successful series, Lethal Weapon helped redefine action movies for the 1980s and 1990s."
The Rock,1996,69,71975,Michael Bay,"FBI chemical warfare expert Stanley Goodspeed (Nicolas Cage) is sent on an urgent mission with a former British spy, John... [More]","Sean Connery, Nicolas Cage, Ed Harris, Michael Biehn","For visceral thrills, it can't be beat. Just don't expect The Rock to engage your brain."
RoboCop,1987,91,96900,Paul Verhoeven,"In a violent, near-apocalyptic Detroit, evil corporation Omni Consumer Products wins a contract from the city government to privatize the... [More]","Peter Weller, Nancy Allen, Ronny Cox, Daniel O'Herlihy","While over-the-top and gory, Robocop is also a surprisingly smart sci-fi flick that uses ultraviolence to disguise its satire of American culture."
John Wick: Chapter 2,2017,89,109336,Chad Stahelski,Retired super-assassin John Wick's plans to resume a quiet civilian life are cut short when Italian gangster Santino D'Antonio shows... [More],"Keanu Reeves, Common, Laurence Fishburne, Riccardo Scamarcio","John Wick: Chapter 2 does what a sequel should -- which in this case means doubling down on the non-stop, thrillingly choreographed action that made its predecessor so much fun."
Casino Royale,2006,94,105896,Martin Campbell,"After receiving a license to kill, British Secret Service agent James Bond (Daniel Craig) heads to Madagascar, where he uncovers... [More]","Daniel Craig, Eva Green, Mads Mikkelsen, Judi Dench","Casino Royale disposes of the silliness and gadgetry that plagued recent James Bond outings, and Daniel Craig delivers what fans and critics have been waiting for: a caustic, haunted, intense reinvention of 007."
Baby Driver,2017,92,122978,Edgar Wright,Talented getaway driver Baby (Ansel Elgort) relies on the beat of his personal soundtrack to be the best in the... [More],"Ansel Elgort, Kevin Spacey, Lily James, Jon Bernthal","Stylish, exciting, and fueled by a killer soundtrack, Baby Driver hits the road and it's gone -- proving fast-paced action movies can be smartly written without sacrificing thrills."
Fist of Legend,1994,100,74498,Gordon Chan,"Chinese martial arts student Chen Zhen (Jet Li) is studying in Kyoto, Japan, when he learns his mentor has died... [More]","Jet Li, Chin Siu Ho, Billy Chow, Yasuaki Kurata",No consensus yet.
The Killer,1989,98,99751,John Woo,"Mob assassin Jeffrey (Chow Yun-Fat) is no ordinary hired gun; the best in his business, he views his chosen profession... [More]","Chow Yun-Fat, Danny Lee, Sally Yeh, Kenneth Tsang",The Killer is another hard-boiled action flick from John Woo featuring eye-popping balletic violence and philosophical underpinnings.
The Raid 2,2014,82,88392,Gareth Evans,"After surviving a bloody fight with powerful gangsters, rookie Jakarta cop Rama (Iko Uwais) thinks he can resume a normal... [More]","Iko Uwais, Yayan Ruhian, Arifin Putra, Oka Antara","Although its high-energy plot and over-the-top violence may play better with genre aficionados, The Raid 2 definitely delivers more of everything audiences loved about its predecessor."
Enter the Dragon,1973,95,98743,Robert Clouse,Bruce Lee plays a martial-arts expert determined to help capture the narcotics dealer whose gang was responsible for the death... [More],"Bruce Lee, John Saxon, Jim Kelly, Ahna Capri","Badass to the max, Enter the Dragon is the ultimate kung-fu movie and fitting (if untimely) Bruce Lee swan song."
Commando,1985,67,68256,Mark L. Lester,"Retired Special Forces soldier John Matrix (Arnold Schwarzenegger) lives with daughter Jenny (Alyssa Milano) in isolation, but his privacy is... [More]","Arnold Schwarzenegger, Rae Dawn Chong, Dan Hedaya, Vernon Wells","The ultimate '80s Schwarzenegger movie, replete with a threadbare plot, outsized action, and endless one-liners."
First Blood,1982,86,86250,Ted Kotcheff,Vietnam veteran and drifter John J. Rambo (Sylvester Stallone) wanders into a small Washington town in search of an old... [More],"Sylvester Stallone, Richard Crenna, Brian Dennehy, David Caruso","Much darker and more sensitive than the sequels it spawned, First Blood is a thrilling survival adventure that takes full advantage of Sylvester Stallone's acting skills."
Mission: Impossible Rogue Nation,2015,94,106915,Christopher McQuarrie,"With the IMF now disbanded and Ethan Hunt (Tom Cruise) out in the cold, a new threat -- called the... [More]","Tom Cruise, Jeremy Renner, Simon Pegg, Rebecca Ferguson",Mission: Impossible Rogue Nation continues the franchise's thrilling resurgence -- and proves that Tom Cruise remains an action star without equal.
The Terminator,1984,100,104539,James Cameron,"Disguised as a human, a cyborg assassin known as a Terminator (Arnold Schwarzenegger) travels from 2029 to 1984 to kill... [More]","Arnold Schwarzenegger, Linda Hamilton, Michael Biehn, Paul Winfield","With its impressive action sequences, taut economic direction, and relentlessly fast pace, it's clear why The Terminator continues to be an influence on sci-fi and action flicks."
Gladiator,2000,78,84776,Ridley Scott,"Commodus (Joaquin Phoenix) takes power and strips rank from Maximus (Russell Crowe), one of the favored generals of his predecessor... [More]","Russell Crowe, Joaquin Phoenix, Connie Nielsen, Oliver Reed",Ridley Scott and an excellent cast successfully convey the intensity of Roman gladitorial combat as well as the political intrigue brewing beneath.
Kill Bill: Vol. 1,2003,85,92985,Quentin Tarantino,"A former assassin, known simply as The Bride (Uma Thurman), wakes from a coma four years after her jealous ex-lover... [More]","Uma Thurman, Lucy Liu, Vivica A. Fox, Michael Madsen",Kill Bill is admittedly little more than a stylish revenge thriller -- albeit one that benefits from a wildly inventive surfeit of style.
The Professional,1994,73,76769,Luc Besson,"Mathilda (Natalie Portman) is only 12 years old, but is already familiar with the dark side of life: her abusive... [More]","Jean Reno, Gary Oldman, Natalie Portman, Danny Aiello",Pivoting on the unusual relationship between seasoned hitman and his 12-year-old apprentice -- a breakout turn by young Natalie Portman -- Luc Besson's Léon is a stylish and oddly affecting thriller.
Speed,1994,94,98289,Jan de Bont,Los Angeles police officer Jack (Keanu Reeves) angers retired bomb squad member Howard Payne (Dennis Hopper) by foiling his attempt... [More],"Keanu Reeves, Dennis Hopper, Sandra Bullock, Joe Morton","A terrific popcorn thriller, Speed is taut, tense, and energetic, with outstanding performances from Keanu Reeves, Dennis Hopper, and Sandra Bullock."
Drunken Master II,1994,84,85425,Chia-Liang Liu,"From a land where honor and tradition reign, comes the legend of a martial-arts hero unlike any other -- the... [More]","Jackie Chan, Ti Lung, Anita Mui, Kar-leung Lau",Jackie Chan sends up some amazing and entertaining fight sequences in The Legend of Drunken Master.
John Wick,2014,86,95554,Chad Stahelski,Legendary assassin John Wick (Keanu Reeves) retired from his violent career after marrying the love of his life. Her sudden... [More],"Keanu Reeves, Michael Nyqvist, Alfie Allen, Willem Dafoe","Stylish, thrilling, and giddily kinetic, John Wick serves as a satisfying return to action for Keanu Reeves -- and what looks like it could be the first of a franchise."
"Crouching Tiger, Hidden Dragon",2000,97,102807,Ang Lee,"In 19th century Qing Dynasty China, a warrior (Chow Yun-Fat) gives his sword, Green Destiny, to his lover (Michelle Yeoh)... [More]","Chow Yun-Fat, Michelle Yeoh, Zhang Ziyi, Chen Chang","The movie that catapulted Ang Lee into the ranks of upper echelon Hollywood filmmakers, Crouching Tiger, Hidden Dragon features a deft mix of amazing martial arts battles, beautiful scenery, and tasteful drama."
Predator,1987,80,82777,John McTiernan,"Dutch (Arnold Schwarzenegger), a soldier of fortune, is hired by the U.S. government to secretly rescue a group of politicians... [More]","Arnold Schwarzenegger, Carl Weathers, Jesse Ventura, Elpidia Carrillo","Predator: Part sci-fi, part horror, part action -- all muscle."
The Bourne Ultimatum,2007,92,103323,Paul Greengrass,Jason Bourne (Matt Damon) continues his international quest to uncover his true identity. From Russia to Europe to northern Africa... [More],"Matt Damon, Julia Stiles, Joan Allen, David Strathairn","The Bourne Ultimatum is an intelligent, finely tuned non-stop thrill ride. Another strong performance from Matt Damon and sharp camerawork from Paul Greengrass make this the finest installment of the Bourne trilogy."
Total Recall,1990,82,87035,Paul Verhoeven,Douglas Quaid (Arnold Schwarzenegger) is a bored construction worker in the year 2084 who dreams of visiting the colonized Mars.... [More],"Arnold Schwarzenegger, Rachel Ticotin, Sharon Stone, Ronny Cox","Under Paul Verhoeven's frenetic direction, Total Recall is a fast-paced rush of violence, gore, and humor that never slacks."
Mad Max 2,1981,94,97509,George Miller,"After avenging the death of his wife and young son at the hands of a vicious gang leader, Max (Mel... [More]","Mel Gibson, Bruce Spence, Emil Minty, Vernon Wells","The Road Warrior is everything a bigger-budgeted Mad Max sequel with should be: bigger, faster, louder, but definitely not dumber."
Heat,1995,88,92852,Michael Mann,"Master criminal Neil McCauley (Robert De Niro) is trying to control the rogue actions of one of his men, while... [More]","Al Pacino, Robert De Niro, Val Kilmer, Jon Voight","Though Al Pacino and Robert De Niro share but a handful of screen minutes together, Heat is an engrossing crime drama that draws compelling performances from its stars -- and confirms Michael Mann's mastery of the genre."
The Raid: Redemption,2011,87,93410,Gareth Huw Evans,"A rookie member of an elite team of commandos, Rama (Iko Uwais) is instructed to hang back while his comrades-in-arms... [More]","Iko Uwais, Joe Taslim, Doni Alamsyah, Yayan Ruhian","No frills and all thrills, The Raid: Redemption is an inventive action film expertly paced and edited for maximum entertainment."
Mission: Impossible -- Fallout,2018,97,124607,Christopher McQuarrie,Ethan Hunt and the IMF team join forces with CIA assassin August Walker to prevent a disaster of epic proportions.... [More],"Tom Cruise, Henry Cavill, Ving Rhames, Simon Pegg","Fast, sleek, and fun, Mission: Impossible - Fallout lives up to the ""impossible"" part of its name by setting yet another high mark for insane set pieces in a franchise full of them."
Raiders of the Lost Ark,1981,96,101804,Steven Spielberg,"Dr. Indiana Jones, a renowned archeologist and expert in the occult, is hired by the U.S. Government to find the... [More]","Harrison Ford, Karen Allen, Paul Freeman, Wolf Kahler","Featuring bravura set pieces, sly humor, and white-knuckle action, Raiders of the Lost Ark is one of the most consummately entertaining adventure pictures of all time."
Aliens,1986,98,104680,James Cameron,"After floating in space for 57 years, Lt. Ripley's (Sigourney Weaver) shuttle is found by a deep space salvage team.... [More]","Sigourney Weaver, Carrie Henn, Michael Biehn, Paul Reiser","While Alien was a marvel of slow-building, atmospheric tension, Aliens packs a much more visceral punch, and features a typically strong performance from Sigourney Weaver."
Hard-Boiled,1992,94,96401,John Woo,A cop who loses his partner in a shoot-out with gun smugglers goes on a mission to catch them. In... [More],"Chow Yun-Fat, Bowie Lam, Philip Chan, Tony Leung Chiu Wai","Boasting impactful action as well as surprising emotional resonance, Hard Boiled is a powerful thriller that hits hard in more ways than one."
